Name,Url,Rating,Tags,Description
Supply Chain Principles,https://www.coursera.org/learn/supply-chain-principles,4.6,"Customer Success, Shipping and Receiving, Chaining, Operations Management, Strategy and Operations, Process, Transportation Operations Management, Supply Chain and Logistics, Sales, Leadership and Management, Design and Product, Planning, Customer Relationship Management, Entrepreneurship, Warehouse Management, Negotiation, Supply Chain Systems, Product Lifecycle, Procurement, Communication, Product Management, Supply Chain, Marketing, Inventory Management, Budget Management, Finance",This course will provide a solid understanding of what a supply chain is all about. The course:\n- Provides an
Introduction to Cyber Attacks,https://www.coursera.org/learn/intro-cyber-attacks,4.7,"Cyberattacks, Cryptography, Threat, Security Engineering, Leadership and Management, Security, Risk, Risk Management, Finance","This course provides learners with a baseline understanding of common cyber security threats, vulnerabilities, and risks. An overview of how"
The Fundamentals of Personal Finance,https://www.coursera.org/specializations/personal-finance-fundamentals,4.6,"Accounting, Behavioral Economics, Budget Management, Business Psychology, Cash Management, Entrepreneurship, Finance, Financial Management, Investment Management, Leadership and Management, Payments, Planning, Risk Management, Supply Chain and Logistics, Taxes","This Specialization is intended for anyone looking to take control of their finances. Through these five courses, you will cover"
Positive Psychology,https://www.coursera.org/learn/positive-psychology,4.7,"Entrepreneurship, Psychology, Resilience, Business Psychology, Meditation, Gratitude, Psychologies","This course discusses research findings in the field of positive psychology, conducted by Barbara Fredrickson and her colleagues. It also"
Practical Data Science with MATLAB,https://www.coursera.org/specializations/practical-data-science-matlab,4.7,"Analysis, Applied Machine Learning, Business Analysis, Correlation And Dependence, Data Analysis, Data Analysis Software, Data Management, Data Visualization, Exploratory Data Analysis, Extract, Transform, Load, Feature Engineering, General Statistics, Linear Algebra, Machine Learning, Machine Learning Algorithms, Mathematics, Plot (Graphics), Probability & Statistics, Probability Distribution, Statistical Analysis, Statistical Visualization, Web Development",Do you find yourself in an industry or field that increasingly uses data to answer questions? Are you working with
Strategy and Sustainability,https://www.coursera.org/learn/strategy-sustainability,4.6,"Sustainability, Conflict Management, Strategy, Strategy and Operations, Marketing, Entrepreneurship, Sales, Leadership and Management, Regulations and Compliance, Finance, Human Resources",Business and environmental sustainability are not natural bedfellows. Business is about making money. Sustainability is about protecting the planet. Business
Qualitative Research Design and Methods for Public Health,https://www.coursera.org/specializations/qualitative-research-design-and-methods-for-public-health,4.8,"Basic Descriptive Statistics, Data Analysis, Entrepreneurship, Market Research, Marketing, Probability & Statistics, Research and Design",This specialization will enable public health professionals and researchers to design effective qualitative studies addressing a range of public health
程序设计与算法,https://www.coursera.org/specializations/biancheng-suanfa,4.8,"Algorithms, Artificial Neural Networks, C Programming Language Family, Computer Programming, Data Management, Deep Learning, Machine Learning, Other Programming Languages, Python Programming, Statistical Programming, Theoretical Computer Science",本专项课程旨在系统培养你的程序设计与编写
Developing Your Musicianship,https://www.coursera.org/specializations/musicianship-specialization,4.8,,"Nurture your love for, and understanding of, music with this specialization. Learn the fundamentals of music theory, including major and"
Expressway to Data Science: Essential Math,https://www.coursera.org/specializations/expressway-to-data-science-essential-math,4.4,"Algebra, Big Data, Calculus, Data Analysis, Data Management, Data Mining, Data Model, Data Structures, Design and Product, Linear Algebra, Mathematical Theory & Analysis, Mathematics, Probability & Statistics, Probability Distribution, Product Design, Software Architecture, Software Engineering, Theoretical Computer Science","Data Science is growing rapidly, creating opportunities for careers across a variety of fields. This specialization is designed for learners"
Digital Fashion Innovation,https://www.coursera.org/specializations/digitalfashioninnovation,4.5,"Communication, Computer Graphic Techniques, Computer Graphics, Digital Marketing, Entrepreneurship, Human Computer Interaction, Interactive Design, Leadership and Management, Marketing, Operations Research, Process, Research and Design, Sales, Social Media, Strategy, Strategy and Operations, Supply Chain Systems, Supply Chain and Logistics, Virtual Reality",Digital Fashion Innovation is a collaboration between Parsons School of Design at The New School and The Digital Fashion Group
Customer Experiences with Contact Center AI - Dialogflow ES,https://www.coursera.org/specializations/customer-experience-gcp,4.5,"Algebra, Artificial Neural Networks, Business Psychology, Cloud Computing, Computer Graphics, Computer Programming, Euler'S Totient Function, Finance, Google Cloud Platform, Human Computer Interaction, Interactive Design, Machine Learning, Natural Language Processing, Research and Design, Software Engineering, Software Testing, User Experience, User Experience Design, Web Development","In this series, learn how to design customer conversations using Contact Center Artificial Intelligence (CCAI). You’ll use Dialogflow ES"
Weight Management: Beyond Balancing Calories,https://www.coursera.org/learn/weight-management-beyond-balancing-calories,4.7,"Supply Chain and Logistics, Planning, Entrepreneurship, Nutrition","Across the globe, more people are suffering from obesity than at any other time in our history. Why has obesity"
The Changing Global Order,https://www.coursera.org/learn/changing-global-order,4.7,"Conflict Management, International Relations, Sales, Marketing, Communication, Global, Leadership and Management, Human Resources, Negotiation",How are international power relations changing and how can global peace and stability be maintained? This course familiarizes you with
Learn to Speak Korean 1,https://www.coursera.org/learn/learn-speak-korean1,4.9,"Grammar, Communication, Korean Language, Language, Listening, Speech",Welcome to Learn to Speak Korean 1!\n \nThis course is for beginner students who are familiar with the Korean
Spacecraft Dynamics and Control,https://www.coursera.org/specializations/spacecraft-dynamics-control,4.8,"Algebra, Algorithms, Angular, Calculus, Computer Programming, Cyberattacks, Data Analysis, Data Analysis Software, Data Management, Data Visualization, Databases, Differential Equations, Entrepreneurship, Estimation, General Statistics, Geometry, Leadership and Management, Linear Algebra, Mathematical Theory & Analysis, Mathematics, Operations Research, Plot (Graphics), Probability & Statistics, Problem Solving, Programming Principles, Python Programming, Research and Design, SQL, Security Engineering, Statistical Programming, Statistical Visualization, Strategy and Operations, Theoretical Computer Science, Web Development",Spacecraft Dynamics and Control covers three core topic areas: the description of the motion and rates of motion of rigid
AI for Medical Diagnosis,https://www.coursera.org/learn/ai-for-medical-diagnosis,4.7,"Theoretical Computer Science, Feature Engineering, Deep Learning, Algorithms, Machine Learning, Probability & Statistics, Statistical Classification, Computer Graphics, Applied Machine Learning, General Statistics","AI is transforming the practice of medicine. It’s helping doctors diagnose patients more accurately, make predictions about patients’ future"
Reporting extra-financier et stratégie RSE,https://www.coursera.org/learn/reporting-extra-financier-strategie-rse,4.7,"Strategy, Business Process Management, Accounting, Performance Management, Finance, Regulations and Compliance, Sales, Marketing, Entrepreneurship, Strategy and Operations, Audit, Brand Management, Communication, Leadership and Management",Une démarche de reporting extra-financier ne se limite pas à la production contraignante et fastidieuse d’un rapport de
Impacts of the Environment on Global Public Health,https://www.coursera.org/specializations/impacts-of-the-environment-on-global-public-health,4.8,"Accounting, Audit, Climate Change, Computer Networking, Entrepreneurship, Market Research, Peering, Probability & Statistics, Research and Design, Software Engineering, Software Testing, Strategy and Operations, Sustainability","In this specialization, you will explore how many public health outcomes are directly influenced by human contact with the environment"
Entrepreneurship Strategy: From Ideation to Exit,https://www.coursera.org/learn/entrepreneurship-strategy,4.8,"Strategy, Entrepreneurship, Strategy and Operations, Entrepreneurial Finance, Sales, Leadership and Management, Marketing, Business Strategy",This course covers in the chronological order each defining step of an entrepreneurial project. It begins with very personal considerations
Visual Elements of User Interface Design,https://www.coursera.org/learn/visual-elements-user-interface-design,4.7,"Interactive Design, User Research, User Experience Design, User Interface, User Experience, Java Annotation, Research and Design, Experience, Human Computer Interaction, Business Psychology, Interfaces",This design-centric course examines the broad question of what an interface is and what role a designer plays in
Plant Bioinformatic Methods,https://www.coursera.org/specializations/plant-bioinformatic-methods,4.7,"Agile Software Development, Algorithms, Analysis, Bioinformatics, Data Management, Data Structures, Data Visualization, Databases, General Statistics, Probability & Statistics, Research and Design, Software Engineering, Statistical Visualization, Theoretical Computer Science","The past 15 years have been exciting ones in plant biology. Hundreds of plant genomes have been sequenced, RNA-seq"
Improving Leadership & Governance in Nonprofit Organizations,https://www.coursera.org/specializations/nonprofit,4.4,"Accounting, Adaptability, Advertising, Algorithms, Application Development, Behavioral Economics, Business Design, Business Psychology, Communication, Entrepreneurship, Leadership and Management, Marketing, Organizational Development, Research and Design, Sales, Software Engineering, Strategy, Strategy and Operations, Supply Chain and Logistics, Theoretical Computer Science","Identify and analyze leadership and governance issues, create practical ways to improve board performance and work with boards to implement"
Creative Thinking: Techniques and Tools for Success,https://www.coursera.org/learn/creative-thinking-techniques-and-tools-for-success,4.7,"Business Analysis, Research and Design, Creativity, Strategy and Operations, Entrepreneurship, Design and Product, Product Development, Critical Thinking, Leadership and Management","In today’s ever-growing and changing world, being able to think creatively and innovatively are essential skills. It can"
Dog Emotion and Cognition,https://www.coursera.org/learn/dog-emotion-and-cognition,4.7,"Entrepreneurship, Evolution, Leadership and Management, Behavior, Probability & Statistics, Animal, Experiment, Research and Design, Communication, Problem Solving","Dog Emotion and Cognition will introduce you to the exciting new study of dog psychology, what the latest discoveries tell"
"The Modern World, Part One: Global History from 1760 to 1910",https://www.coursera.org/learn/modern-world,4.8,History,This is a survey of modern history from a global perspective. Part One begins with the political and economic revolutions
Integrative Nursing,https://www.coursera.org/specializations/integrative-nursing,4.8,"Business Psychology, Change Management, Communication, Entrepreneurship, Human Resources, Leadership and Management, People Development, Strategy and Operations","You will identify ways to implement the six principles of Integrative Nursing in your work setting, then learn how to"
Decentralized Finance (DeFi) Primitives,https://www.coursera.org/learn/decentralized-finance-primitives-duke,4.9,"Security Engineering, BlockChain, FinTech, Theoretical Computer Science, Cryptography, Finance, Encryption",DeFi and the Future of Finance is a set of four courses that focus on decentralized finance. The second course
Financial Accounting Fundamentals,https://www.coursera.org/learn/uva-darden-financial-accounting,4.8,"Accounting, Balance Sheet, Cash Flow, Flow Network, Finance, Generally Accepted Accounting Principles (GAAP), General Accounting, Analysis, Financial Statement, Financial Accounting, Accounts Payable and Receivable","This course, developed at the Darden School of Business at the University of Virginia and taught by top-ranked faculty"
An Introduction to Accessibility and Inclusive Design,https://www.coursera.org/learn/accessibility,4.8,"User Experience Design, Web, User Experience, Research and Design, Human Computer Interaction, Documents, Business Psychology",This course introduces some of the fundamental principles of accessibility and prepares learners for further study in accessibility and inclusive
Content Strategy for Professionals,https://www.coursera.org/specializations/content-strategy,4.6,"Audience, Business Psychology, Communication, Computer Networking, Entrepreneurship, Experience, Human Learning, Influencing, Leadership and Management, Marketing, Network Model, Planning, Sales, Social Media, Strategy, Strategy and Operations, Supply Chain and Logistics, User Experience, Writing","Content Strategy uses credible, trustworthy, transparent media to communicate stories and information to enhance an organization’s strategic goals. In"
Microsoft Power Platform Fundamentals,https://www.coursera.org/learn/microsoft-power-platform-fundamentals,4.3,"Business Analysis, Cloud Applications, Software Engineering, Cloud Platforms, Cloud Computing, Application Development, Business Intelligence, Data Management","In this course, you will learn the business value and product capabilities of Power Platform. You will create simple Power"
Claves para la innovación en la docencia universitaria,https://www.coursera.org/learn/innovacion-docencia-universitaria,4.8,"Innovation, Research and Design, Entrepreneurship, Problem Solving, Teaching","Este curso nace en el seno del proyecto europeo (Erasmus, Acción K2 Capacity Building) TO INN From Tradition to Innovation"
Camino a la Excelencia en Gestión de Proyectos,https://www.coursera.org/learn/camino-excelencia-gestion-proyectos,4.7,"Planning, Entrepreneurship, Supply Chain and Logistics, Strategy and Operations, Project Management, Streams, Leadership and Management, Mapping, Project",El curso “Camino a la excelencia en gestión de proyectos” describe los tres principales componentes de Lean Project Management (Gestión
Business English,https://www.coursera.org/specializations/english-for-business,4.7,"Brand Management, Business Communication, Communication, Entrepreneurship, Leadership, Leadership and Management, Marketing, Marketing Design, Negotiation, Presentation, Research and Design, Sales, Strategy, Strategy and Operations, Survey Creation","This Specialization serves as an introduction to Business English, where you will learn to communicate about topics such as management"
Introduction to Augmented Reality and ARCore,https://www.coursera.org/learn/ar,4.5,"User Experience Design, Research and Design, Machine Learning, Computer Vision, Business Psychology, Human Computer Interaction, Augmented Reality, User Experience","This class will teach you the fundamentals of augmented reality (AR), and how to build an AR experience using ARCore"
Social Impact Strategy: Tools for Entrepreneurs and Innovators,https://www.coursera.org/learn/social-impact,4.8,"Change Management, Analysis, Entrepreneurship, Innovation, Strategy and Operations, Leadership and Management, Sales, Performance Management, Research and Design, Modeling, Strategy, Business Design, Marketing, Logic, Problem Solving, Social Entrepreneurship","This course offers an introduction to social impact strategy and social entrepreneurship, including key concepts, an overview of the field"
Data Visualization with Python,https://www.coursera.org/learn/python-for-data-visualization,4.5,"Statistical Visualization, Python Programming, Geovisualization, Statistical Programming, Probability & Statistics, Plot (Graphics), Computer Programming, General Statistics, Data Visualization, Map, Matplotlib","""A picture is worth a thousand words"". We are all familiar with this expression. It especially applies when trying"
TensorFlow: Data and Deployment,https://www.coursera.org/specializations/tensorflow-data-and-deployment,4.6,"Android Development, Application Development, Applied Machine Learning, Computer Architecture, Computer Programming, Computer Vision, Cross Platform Development, Data Management, Data Visualization, Deep Learning, Entrepreneurship, Extract, Transform, Load, HTML and CSS, Javascript, Leadership and Management, Machine Learning, Machine Learning Algorithms, Machine Learning Software, Marketing, Microarchitecture, Mobile Development, Mobile Development Tools, Modeling, Problem Solving, Python Programming, Research and Design, Security Engineering, Software Engineering, Statistical Programming, Swift Programming, Theoretical Computer Science, Visualization (Computer Graphics), Web Development, iOS Development",Continue developing your skills in TensorFlow as you learn to navigate through a wide range of deployment scenarios and discover
Supply Chain Logistics,https://www.coursera.org/learn/supply-chain-logistics,4.8,"Inventory Management, Transportation Operations Management, Supply Chain and Logistics, Operations Management, Supply Chain Systems, Chaining, Leadership and Management, Supply Chain",Have you ever wondered how goods get delivered to us so quickly as soon as we order them? One word
Sustainable Fashion,https://www.coursera.org/learn/sustainable-fashion,4.8,"Sustainability, Modeling, Economy, Advertising, Communication, Marketing","Sometimes when we say we work with sustainable fashion people look at us like... ""Mmmm, is it really possible for"
Autodesk Certified Professional: AutoCAD for Design and Drafting Exam Prep,https://www.coursera.org/learn/autodesk-autocad-design-drafting,4.7,"Computer Graphic Techniques, Computer Graphics, Graphics Software",Prove to potential employers that you’re up to the task by becoming an Autodesk Certified Professional. This online course
Solar Energy Basics,https://www.coursera.org/learn/solar-energy-basics,4.8,"Theoretical Computer Science, Entrepreneurship, Problem Solving, Research and Design, Operating Systems, Mathematics, Leadership and Management, Systems Design, Energy, Solar Energy",This course gives you an introduction to the fundamentals of solar power as it applies to solar panel system installations
"Aspectos básicos: Datos, datos, en todas partes",https://www.coursera.org/learn/aspectos-basicos-datos-datos-en-todas-partes,4.8,"Business Analysis, Statistical Programming, Strategy, Marketing, Decision Making, Data Analysis, Strategy and Operations, Sales, Entrepreneurship, Analysis, Process, Data Management, Data Visualization, Spreadsheet, Databases, Process Analysis, Leadership and Management, SQL, Data Visualization Software",Este es el primer curso del certificado de Google Data Analytics. En estos cursos obtendrás las habilidades que necesitas para
Introduction to Google SEO,https://www.coursera.org/learn/search-engine-optimization,4.6,"Back-End Web Development, Algorithms, Research and Design, Theoretical Computer Science, Mathematics, Mathematical Optimization, Search Engine Optimization, Human Computer Interaction, Web Development, User Experience, Persona Research","Ever wonder how major search engines such as Google, Bing and Yahoo rank your website within their searches? Or how"
Fundamentals of Visualization with Tableau,https://www.coursera.org/learn/data-visualization-tableau,4.5,"Tableau Software, Business Analysis, Data Analysis, Software, Data Analysis Software, Data Visualization, Data Visualization Software","In this first course of this specialization, you will discover what data visualization is, and how we can use it"
Cyber Security Fundamentals,https://www.coursera.org/learn/cyber-security-fundamentals,4.8,"Security Engineering, Operating Systems, Risk Management, System Security, Finance",This course is intended to provide a general introduction to key concepts in cyber security. It is aimed at anyone
Business Analytics,https://www.coursera.org/specializations/analytics,4.6,"Accounting, Algorithms, Analysis, Analytics, Audit, Big Data, BlockChain, Business Analysis, Business Analytics, Data Analysis, Data Analysis Software, Data Management, Data Mining, Data Visualization, Design and Product, Entrepreneurship, Finance, Graph Theory, Human Computer Interaction, Machine Learning, Machine Learning Algorithms, Market Research, Mathematics, Natural Language Processing, Network Analysis, Probability & Statistics, R Programming, Research and Design, Software Engineering, Software Testing, Statistical Analysis, Statistical Programming, Theoretical Computer Science, User Research","Our world has become increasingly digital, and business leaders need to make sense of the enormous amount of available data"
IBM AI Enterprise Workflow,https://www.coursera.org/specializations/ibm-ai-workflow,4.3,"Algorithms, Application Development, Applied Machine Learning, Business Analysis, Business Process Management, Business Psychology, Cloud API, Cloud Computing, Computer Programming, Cross Platform Development, Data Analysis, Data Management, Data Visualization, Entrepreneurship, Exploratory Data Analysis, Forecasting, General Statistics, Kubernetes, Leadership and Management, Machine Learning, Mobile Development, Operations Management, Organizational Development, Probability & Statistics, Problem Solving, Python Programming, Reinforcement Learning, Research and Design, Software Engineering, Software Testing, Statistical Analysis, Statistical Programming, Statistical Visualization, Strategy and Operations, Theoretical Computer Science",This six course specialization is designed to prepare you to take the certification examination for IBM AI Enterprise Workflow V1
Introduction to Scripting in Python,https://www.coursera.org/specializations/introduction-scripting-in-python,4.7,"Analysis, Computer Programming, Mathematics, Python Programming, Statistical Programming","Developed by Rice University's world-class Computer Science & Data Science faculty, this specialization is intended for beginners who would"
Satisfaction Guaranteed: Develop Customer Loyalty Online,https://www.coursera.org/learn/satisfaction-guaranteed,4.8,"Customer Success, Customer Support, Marketing, Research and Design, Data Analysis, Supply Chain and Logistics, Sales, Customer Relationship Management, Entrepreneurship, Market Research, Gratitude, Finance, Strategy and Operations, Human Resources, Communication",You made it! Satisfaction Guaranteed: Develop Customer Loyalty Online is the seventh and final course in the Google Digital Marketing
Politics and Economics of International Energy,https://www.coursera.org/learn/global-energy,4.7,"Economics, Regulations and Compliance, Market (Economics), Finance, Energy","Energy issues have always been important in international relations, but in recent years may have become even more important than"
The Business of Product Management I,https://www.coursera.org/learn/the-business-of-product-management-one,4.5,Design and Product,"Sponsored by AMAZON WEB SERVICES (AWS). Learn real-world PM lessons from Amazon, Intuit, Procter and Gamble, Barnes and Noble"
Write A Feature Length Screenplay For Film Or Television,https://www.coursera.org/learn/write-a-feature-length-screenplay-for-film-or-television,4.5,"Creativity, Communication, Research and Design, Writing, Entrepreneurship","Write a Full Length Feature Film Script\n\nIn this course, you will write a complete, feature-length screenplay for"
Introduction to Thermodynamics: Transferring Energy from Here to There,https://www.coursera.org/learn/thermodynamics-intro,4.8,"Mathematics, Business Analysis, Analysis, Strategy and Operations, Calculus, Entrepreneurship, Research and Design, Mechanical Engineering, Energy, Critical Thinking, Problem Solving, Leadership and Management",COURSE DESCRIPTION\nThis course provides an introduction to the most powerful engineering principles you will ever learn - Thermodynamics: the science
Nutrición y obesidad: control de sobrepeso,https://www.coursera.org/learn/nutricion-obesidad-sobrepeso,4.8,Nutrition,"En este curso, ofrecido por la UNAM, reconocerás una herramienta para evitar, manejar y controlar el sobrepeso y la obesidad"
Fundamentals of Engineering Exam Review,https://www.coursera.org/learn/fe-exam,4.7,"Linear Algebra, Probability Distribution, Probability & Statistics, Calculus, Computer Graphic Techniques, Differential Equations, Algebra, Mathematics, General Statistics, Graphics Software, Computer Graphics, Geometry",The purpose of this course is to review the material covered in the Fundamentals of Engineering (FE) exam to enable
